{
  "$schema": "https://json-schema.org/draft/2020-12/schema",
  "$id": "https://example.invalid/excel-block-parser/project-v3.schema.json",
  "title": "Excel Block Parser Project v3",
  "type": "object",
  "required": ["version", "exportedAt", "project", "data", "blockResults"],
  "properties": {
    "version": { "const": 3 },
    "exportedAt": { "type": "string", "format": "date-time" },
    "project": { "$ref": "#/$defs/project" },
    "data": { "type": "object" },
    "blockResults": { "type": "array", "items": { "$ref": "#/$defs/blockResult" } },
    "regionResults": { "type": "array", "items": { "$ref": "#/$defs/regionResult" } }
  },
  "additionalProperties": false,
  "$defs": {
    "jsonValue": {
      "anyOf": [
        { "type": ["string", "number", "boolean", "null"] },
        { "type": "array", "items": { "$ref": "#/$defs/jsonValue" } },
        { "type": "object", "additionalProperties": { "$ref": "#/$defs/jsonValue" } }
      ]
    },
    "cellRange": {
      "type": "object",
      "required": ["startRow", "startCol", "endRow", "endCol", "a1Notation"],
      "properties": {
        "startRow": { "type": "integer", "minimum": 0 },
        "startCol": { "type": "integer", "minimum": 0 },
        "endRow": { "type": "integer", "minimum": 0 },
        "endCol": { "type": "integer", "minimum": 0 },
        "a1Notation": { "type": "string", "minLength": 1 }
      },
      "additionalProperties": false
    },
    "valueMapEntry": {
      "type": "object",
      "required": ["from", "to"],
      "properties": {
        "from": { "type": "string" },
        "to": { "$ref": "#/$defs/jsonValue" }
      },
      "additionalProperties": false
    },
    "columnMapping": {
      "type": "object",
      "required": ["colIndex", "colLetter", "suggestedKey", "key", "type", "skip", "valueMap"],
      "properties": {
        "colIndex": { "type": "integer", "minimum": 0 },
        "colLetter": { "type": "string", "minLength": 1 },
        "suggestedKey": { "type": "string" },
        "key": { "type": "string" },
        "type": { "enum": ["auto", "string", "integer", "float", "boolean", "date", "valueMapping"] },
        "skip": { "type": "boolean" },
        "valueMap": { "type": "array", "items": { "$ref": "#/$defs/valueMapEntry" } },
        "valueMapFallbackType": { "enum": ["auto", "string", "integer", "float", "boolean", "date"] }
      },
      "additionalProperties": false
    },
    "rowFilterRule": {
      "type": "object",
      "required": ["type", "column", "operator"],
      "properties": {
        "type": { "const": "rule" },
        "column": { "type": "string", "minLength": 1 },
        "operator": { "enum": ["eq", "neq", "in", "notIn", "contains", "notContains", "empty", "notEmpty", "regex", "notRegex"] },
        "value": { "type": "string", "minLength": 1 },
        "values": { "type": "array", "items": { "type": "string", "minLength": 1 }, "minItems": 1 }
      },
      "additionalProperties": false,
      "allOf": [
        {
          "if": { "properties": { "operator": { "enum": ["in", "notIn"] } }, "required": ["operator"] },
          "then": { "properties": { "values": {}, "value": {} }, "required": ["values"], "not": { "properties": { "value": {} }, "required": ["value"] } }
        },
        {
          "if": { "properties": { "operator": { "enum": ["empty", "notEmpty"] } }, "required": ["operator"] },
          "then": { "properties": { "value": {}, "values": {} }, "not": { "anyOf": [{ "properties": { "value": {} }, "required": ["value"] }, { "properties": { "values": {} }, "required": ["values"] }] } }
        },
        {
          "if": { "properties": { "operator": { "enum": ["eq", "neq", "contains", "notContains", "regex", "notRegex"] } }, "required": ["operator"] },
          "then": { "properties": { "value": {}, "values": {} }, "required": ["value"], "not": { "properties": { "values": {} }, "required": ["values"] } }
        }
      ]
    },
    "rowFilterGroup": {
      "type": "object",
      "required": ["type", "conditions"],
      "properties": {
        "type": { "enum": ["all", "any"] },
        "conditions": { "type": "array", "items": { "$ref": "#/$defs/rowFilterCondition" }, "minItems": 1, "maxItems": 100 }
      },
      "additionalProperties": false
    },
    "rowFilterCondition": {
      "oneOf": [
        { "$ref": "#/$defs/rowFilterRule" },
        { "$ref": "#/$defs/rowFilterGroup" }
      ]
    },
    "rowFilter": {
      "type": "object",
      "required": ["removeEmptyRows", "emptyCellConditions", "condition"],
      "properties": {
        "removeEmptyRows": { "type": "boolean" },
        "emptyCellConditions": {
          "type": "object",
          "required": ["fullyStruck"],
          "properties": { "fullyStruck": { "type": "boolean" } },
          "additionalProperties": false
        },
        "condition": {
          "oneOf": [
            { "$ref": "#/$defs/rowFilterCondition" },
            { "type": "null" }
          ]
        },
        "matchMode": { "enum": ["include", "exclude"] }
      },
      "additionalProperties": false
    },
    "tag": {
      "type": "object",
      "required": ["type", "key"],
      "properties": {
        "type": { "enum": ["label", "kv"] },
        "key": { "type": "string", "minLength": 1 },
        "value": { "type": "string" }
      },
      "additionalProperties": false
    },
    "block": {
      "type": "object",
      "required": ["id", "label", "range", "activeSheet", "headerRows", "collapsed", "selectionLocked", "columns", "dataSnapshot"],
      "properties": {
        "id": { "type": "string", "minLength": 1 },
        "label": { "type": "string" },
        "workbookId": { "type": ["string", "null"] },
        "range": { "oneOf": [{ "$ref": "#/$defs/cellRange" }, { "type": "null" }] },
        "activeSheet": { "type": ["string", "null"] },
        "headerRows": { "type": "array", "items": { "type": "integer", "minimum": 0 }, "uniqueItems": true },
        "collapsed": { "type": "boolean" },
        "selectionLocked": { "type": "boolean" },
        "columns": { "type": "array", "items": { "$ref": "#/$defs/columnMapping" } },
        "dataSnapshot": {
          "oneOf": [
            { "type": "array", "items": { "type": "array", "items": { "$ref": "#/$defs/jsonValue" } } },
            { "type": "null" }
          ]
        },
        "headerSnapshot": {
          "oneOf": [
            { "type": "array", "items": { "type": "string" } },
            { "type": "array", "items": { "type": "array", "items": { "type": "string" } } }
          ]
        },
        "rowFilter": { "$ref": "#/$defs/rowFilter" },
        "skipEmptyColumns": { "type": "boolean" },
        "tags": { "type": "array", "items": { "$ref": "#/$defs/tag" } }
      },
      "additionalProperties": false
    },
    "ownedBlock": {
      "allOf": [
        { "$ref": "#/$defs/block" },
        { "type": "object", "required": ["workbookId"], "properties": { "workbookId": { "type": "string", "minLength": 1 } } }
      ]
    },
    "splitRule": {
      "type": "object",
      "required": ["type"],
      "properties": {
        "type": { "enum": ["keyword", "emptyRow", "emptyColumn"] },
        "keyword": { "type": "string" },
        "minGap": { "type": "integer", "minimum": 1 }
      },
      "additionalProperties": false
    },
    "region": {
      "type": "object",
      "required": ["id", "label", "workbookId", "range", "activeSheet", "splitRules", "blocks", "collapsed", "selectionLocked"],
      "properties": {
        "id": { "type": "string", "minLength": 1 },
        "label": { "type": "string" },
        "workbookId": { "type": "string", "minLength": 1 },
        "range": { "oneOf": [{ "$ref": "#/$defs/cellRange" }, { "type": "null" }] },
        "activeSheet": { "type": ["string", "null"] },
        "splitRules": { "type": "array", "items": { "$ref": "#/$defs/splitRule" } },
        "blocks": { "type": "array", "items": { "$ref": "#/$defs/block" } },
        "collapsed": { "type": "boolean" },
        "selectionLocked": { "type": "boolean" },
        "tags": { "type": "array", "items": { "$ref": "#/$defs/tag" } }
      },
      "additionalProperties": false
    },
    "workbook": {
      "type": "object",
      "required": ["id", "name"],
      "properties": {
        "id": { "type": "string", "minLength": 1 },
        "name": { "type": "string", "minLength": 1 },
        "sourcePath": { "type": "string", "minLength": 1 },
        "sheetNames": { "type": "array", "items": { "type": "string" }, "uniqueItems": true },
        "sheetTabColors": {
          "type": "object",
          "additionalProperties": { "type": "string", "pattern": "^#[0-9a-fA-F]{6}$" }
        },
        "activeSheetName": { "type": ["string", "null"] },
        "displaySettings": {
          "type": "object",
          "required": ["showOutlines", "showFrozenPanes"],
          "properties": {
            "showOutlines": { "type": "boolean" },
            "showFrozenPanes": { "type": "boolean" }
          },
          "additionalProperties": false
        }
      },
      "additionalProperties": false
    },
    "project": {
      "type": "object",
      "required": ["id", "name", "workbooks", "activeWorkbookId", "blocks", "regions", "activeBlockId", "activeRegionId", "focusMode"],
      "properties": {
        "id": { "type": "string", "minLength": 1 },
        "name": { "type": "string", "minLength": 1 },
        "workbooks": { "type": "array", "items": { "$ref": "#/$defs/workbook" } },
        "activeWorkbookId": { "type": ["string", "null"] },
        "blocks": { "type": "array", "items": { "$ref": "#/$defs/ownedBlock" } },
        "regions": { "type": "array", "items": { "$ref": "#/$defs/region" } },
        "activeBlockId": { "type": "string" },
        "activeRegionId": { "type": ["string", "null"] },
        "focusMode": { "enum": ["always-editable", "activate-first"] },
        "pythonScript": {
          "type": "object",
          "required": ["entryPath", "files"],
          "properties": {
            "entryPath": { "type": "string", "minLength": 1 },
            "files": {
              "type": "array",
              "minItems": 1,
              "items": {
                "type": "object",
                "required": ["path", "source"],
                "additionalProperties": false,
                "properties": {
                  "path": { "type": "string", "minLength": 1 },
                  "source": { "type": "string", "maxLength": 2097152 }
                }
              }
            }
          },
          "additionalProperties": false
        }
      },
      "additionalProperties": false
    },
    "blockResult": {
      "type": "object",
      "required": ["blockId", "label", "workbookId", "data", "rowCount"],
      "properties": {
        "blockId": { "type": "string", "minLength": 1 },
        "label": { "type": "string" },
        "workbookId": { "type": "string", "minLength": 1 },
        "data": { "type": "array", "items": { "type": "object", "additionalProperties": { "$ref": "#/$defs/jsonValue" } } },
        "rowCount": { "type": "integer", "minimum": 0 },
        "sourceRowIndices": {
          "type": "array",
          "items": { "type": "integer", "minimum": 0 }
        }
      },
      "additionalProperties": false
    },
    "regionBlockResult": {
      "type": "object",
      "required": ["blockLabel", "rows"],
      "properties": {
        "blockLabel": { "type": "string" },
        "rows": { "type": "array", "items": { "type": "array", "items": { "type": "string" } } },
        "range": { "$ref": "#/$defs/cellRange" }
      },
      "additionalProperties": false
    },
    "regionResult": {
      "type": "object",
      "required": ["regionId", "label", "workbookId", "blocks"],
      "properties": {
        "regionId": { "type": "string", "minLength": 1 },
        "label": { "type": "string" },
        "workbookId": { "type": "string", "minLength": 1 },
        "blocks": { "type": "array", "items": { "$ref": "#/$defs/regionBlockResult" } }
      },
      "additionalProperties": false
    }
  }
}
